术唯可2mL维生素CVC05ml补水套餐淡黄嫩肤改善肤质,288.0,6345
套餐海菲秀光子嫩肤嫩肤模式AOPT黄金超光子正规采买净颜嫩肤,1160.0,4611
光子嫩肤嫩肤模式M22王者之冠正规采买规范操作,258.0,4487
国产品牌100单位瘦脸瘦咬肌V脸支持扫码当面验真,579.0,2905
激光脱毛6次唇部腋下2选1进口仪器冰感舒适脱掉尴尬,98.0,3225
小气泡美肤性价比高深层清洁改善黑头日常维养,199.0,3161
美国品牌20单位鱼尾纹鼻背纹眉间纹3选1支持扫码当面验真,598.0,2067
国产品牌200单位瘦腿瘦肩2选1双侧美腿美肩现场可查验,1579.0,1254
激光脱毛6次上唇部等6个部位6选3进口仪器冰感舒适,1562.0,592
国产品牌20单位抬头纹国产抬头纹正品保真改善皱纹,699.0,1224
皮秒激光PicoWay超皮秒全模式淡斑正规采买支持验真,1519.0,1152
激光脱毛12次大腿小腿小臂大臂四肢年卡进口仪器冰感舒适,2011.0,557
套餐嗨体25mL光子嫩肤嫩肤模式M22王者之冠支持扫码可验真,339.0,751
套餐光子嫩肤AOPT黄金超光子M22光子嫩肤第七代光子嫩肤,666.0,666
套餐酷塑腹部腰腹侧腰2个点位隔空减脂腰腹正规采买正版仪器,4580.0,686
韩国品牌80100单位瘦脸进口瘦脸扫码验真改善咬肌,999.0,565
国产品牌100单位提升下颌缘瘦咬肌二项套餐瘦脸下颌提升,780.0,713
嗨体15mL淡化颈部细纹正规采买支持验真,852.0,581
绽Z娅水光5mL补水保湿淡斑收缩毛孔,399.0,572
套餐第四代热玛吉光子嫩肤正版仪器支持四维认证抗衰紧肤,9499.0,409
白瓷娃娃C6背部嫩白美背嫩肤支持验真,1980.0,414
润百颜黑金1mL润百颜黑金玻尿酸1ml大分子支持扫码验真,399.0,994
美国品牌100单位瘦脸改善咬肌当面验真可视化配药,2979.0,295
光子淡斑M22王者之冠淡斑嫩肤改善肤质,288.0,424
激光脱毛12次小腿大腿大臂小臂4选1年卡进口仪器冰感舒适,709.0,332
套餐Fotona4DPro光子嫩肤仪器验真抗衰嫩肤联合治疗,2880.0,414
套餐Fotona4DPro半岛超声炮抗敏修护黄极光联合抗衰支持验真,8799.0,185
套餐国产品牌注射颏肌放松瘦脸下颌缘提升颏肌放松,1449.0,274
激光脱毛6次上唇部下唇部2选1进口仪器冰感舒适净肤美肤,99.0,297
伊婉致美1mL伊婉VVPlus韩国进口大分子玻尿酸支持扫码,1280.0,289
微针美塑改善痘痘痘坑收缩毛孔改善肤质,625.0,239
光子嫩肤AOPT超光子含3张滤光片嫩肤淡斑改善色沉等,469.0,240
瑞蓝2号1mL铂金瑞蓝玻尿酸塑形1ml支持扫码当面验真填充或淡皱,2233.0,267
隔空减脂手臂小腿腰部腹部大腿5选1定点排脂减脂瘦身随做随走,199.0,289
套餐嗨体25mL玻尿酸精华导入华熙丝丽水光VC05ml共6ml水光,639.0,188
新一代热玛吉面部600发四维认证支持扫码,15120.0,147
第四代热玛吉面部眼周1350发正版仪器支持验真单人单头,16020.0,213
射频紧肤面部紧肤套餐599元紧致提升抗衰老,299.0,173
国产品牌300单位瘦腿腿部塑形改善腿部肌肉支持验真,2739.0,160
套餐第四代热玛吉面颈部1200发嗨体25mL四维验真足量发数,15484.0,195
射频紧肤眼周细纹年轻双眸紧致抗衰正规采买规范操作,199.0,157
乔雅登雅致08mL支持扫码当面验真丰盈填充轮廓塑形,3999.0,243
射频减脂脸部下巴下颌缘3选1黄金微雕免费接车免费面诊,4699.0,236
埋线双眼皮免费面诊不切开双眼皮,1979.0,113
套餐光子嫩肤润致水光2mL闪光娃娃套餐补水嫩肤,3980.0,15
海菲秀HydraFacial美国进口清洁皮肤美白嫩肤,979.0,116
润致水光2mL水光导入收缩毛孔补水保湿抗衰老,1780.0,83
射频紧肤面部紧肤黄金射频淡化痘印痘坑美白嫩肤,1800.0,120
美国品牌50单位瘦脸适合补打或咬肌较小现场验真后操作,1889.0,78
光子嫩肤嫩肤模式黑金超光子淡黄美白改善肤质仪器验真,1380.0,91
国产品牌5080单位提升下颌缘支持扫码当面验真,699.0,83
皮秒激光PicoSure蜂巢皮秒全模式淡斑正版仪器支持验真,1599.0,74
射频紧肤下颌缘双下巴面颊紧肤3选1钻石超塑提升紧肤抵抗衰老,1314.0,82
套餐Fotona4DPro颈部等3个部位3选2嗨体25mL抗衰补水套餐,6999.0,50
套餐嗨体25mL术唯可2mL维生素CVC05ml嗨体5ml套餐,588.0,58
第四代热玛吉眼周面颈部1650发正规采买支持验真,17820.0,62
海薇M1mL扫码验真大分子玻尿酸可填充部位广性价比高,556.0,89
膨体隆鼻立秀免费接车免费面诊自然美鼻不透光,8799.0,20
面部轮廓综合1项自体脂肪丰面颊等免费接车四级资质,4679.0,38
半永久纹眉纹绣美学设计改善眉形仿真裸妆,680.0,48
套餐Fotona4DPro第四代热玛吉联合抗衰正版仪器当面验真,12800.0,47
眼部综合4项切开双眼皮内眼角祛皮祛脂免费接车四级资质,6800.0,57
种植发际线1000单位FUE种植免费接车免费面诊改善大额头,3665.0,58
姣兰1mL丰唇玻尿酸性价比高免费面诊预约美化唇形,1188.0,60
韩国品牌20单位鼻背纹眉间纹鱼尾纹3选1进口淡皱支持验真,349.0,37
套餐光子嫩肤全模式AOPT黄金超光子嗨体25mL正版仪器补水嫩肤,699.0,36
套餐嗨体熊猫1mL嗨体15mL眼周年轻颈纹优选支持验真店铺推荐,3799.0,27
抗衰套餐半岛超声炮超声软组织理疗抗敏修护联合治疗支持验真,8800.0,66
射频紧肤眼周细纹下颌缘颈部紧肤3选1首单专享价BTL超频刀,499.0,25
PrincessVolume1mL进口公主玻尿酸支持扫码当面验真,4399.0,27
美国品牌100单位提升下颌缘瘦脸进口支持扫码当面验真,3980.0,28
套餐伊婉婉美1mL伊婉C1mL韩国进口玻尿酸套餐扫码验真,1580.0,31
射频紧肤手臂大腿腰部腹部小腿身体塑型非侵入式瘦身,1759.0,26
套餐微创祛眼袋隔空减脂腰部等5个部位5选1眼周抗衰,2979.0,24
射频紧肤面部紧肤套餐999元BTL爱丽丝超频刀抗衰紧致,729.0,21
韩国品牌100200单位瘦脸提升下颌缘进口瘦脸扫码验真,1979.0,20
激光紧肤面部紧肤面部细纹赛诺龙5GMax提拉紧致面部紧致美白,2279.0,12
乔雅登极致08mL玻尿酸正规采买可接受验真,8799.0,14
黄金热拉提20全面部不含眼周紧致提升定点模式,3800.0,22
眼部综合2项切开双眼皮内眼角免费接车免费面诊四级资质,3979.0,11
莫娜丽莎1mL进口大分子玻尿酸支持扫码当面验真美学设计,1980.0,11
韩国品牌3050单位抬头纹等5个部位5选2进口淡皱支持验真,799.0,7
艾莉薇经典版1mL韩国进口玻尿酸扫码验真官网可查,1080.0,7
美国品牌50单位鱼尾纹眉间纹抬头纹含抬头纹改善皱纹套餐,2750.0,9
手术吸脂脸部等11个部位11选3免费接车免费面诊,8800.0,5
抗衰套餐第四代热玛吉半岛超声炮联合治疗正版仪器当面验真,12998.0,4
点阵激光点阵激光面部激光清痘痘坑痘印解决肌肤肤质问题,1080.0,10
切开双眼皮免费面诊无张力缝合隐痕自然,1079.0,10
艾莉薇传奇版1mL艾莉薇传奇玻尿酸1ml填充塑形解决面部凹陷舒适体验,4101.0,7
自体脂肪隆胸免费接车四级手术资质医院,17820.0,4
伤痕修复妊娠纹修复修复妊娠纹体验尝鲜,99.0,8
射频减脂下巴下颌缘黄金微雕免费接车免费面诊减脂l脸,9299.0,9
法思丽1mL玻尿酸改善面部凹陷丰面颊等7部位支持扫码当面验真,1449.0,4
可丽金水光4mL焕颜抗衰提亮肤色缩小毛孔,2880.0,6
瑞蓝唯v1mL瑞蓝唯v水光导入1ml高端抗衰收缩毛孔紧致皮肤,8799.0,6
瑞蓝丽v1mL玻尿酸大颗粒塑形支持扫码当面验真,8800.0,4
套餐嗨体15mL嗨体25mL淡化颈纹支持验真可视化配药,1940.0,3
射频紧肤面部紧肤钻石超塑紧致提升上镜小脸,2680.0,4
种植发际线3000单位FUE毛发种植免费接车免费面诊加密头发,9888.0,3
激光淡疤15cm2点阵平扶疤痕痘印疤痕修复调整肌肤光泽,735.0,10
套餐酷塑隔空减脂4个点冷冻减脂升级仪器,15200.0,3
激光淡斑黑金DPL超光子正规采买支持验真淡斑焕肤,3030.0,5
光子嫩肤全模式AOPT黄金超光子维养小魔盒皮肤屏障维养包,589.0,10
抗敏修护维养小魔盒易敏肤质改善包K8舒敏之星,369.0,1
种植发际线1500单位FUE毛发种植免费接车免费面诊,6888.0,2
隔空减脂腹部背部腰部手臂4选1钻石超塑腹部背部腰部手臂4选1,2980.0,2
自体脂肪全脸填充免费接车改善凹陷少女自然脸,10600.0,3
套餐光子嫩肤全模式AOPT黄金超光子海菲秀毛孔小魔盒,1259.0,1
嗨体25mL维养小魔盒水光入门卡,449.0,2
套餐光子嫩肤全模式AOPT黄金超光子术唯可2mL维养小魔盒亮肤经典,789.0,0
套餐国产品牌术唯可2mL维养小魔盒水油平衡包,459.0,0
杏枝山5mL淡斑改善色沉亮白美肌,1980.0,1
套餐抗衰小魔盒,1269.0,1
乔雅登质颜1mL玻尿酸支持扫码当面验真美学设计,15800.0,1
婕尔1mL婕尔玻尿酸1ml塑形填充二合一改善面部凹陷细纹,1980.0,0
激光减脂下巴下颌缘5G天使减脂免费接车仪器验真,16800.0,1
爱芙莱1mL爱芙莱玻尿酸1ml小分子填充面部凹陷面颊,588.0,2
乔雅登丰颜1mL玻尿酸支持扫码当面验真立体塑型,15800.0,2
套餐乔雅登雅致08mL乔雅登极致08mL玻尿酸组合当面验真,9999.0,0
套餐面部轮廓综合2项隔空减脂腰部腹部2选1颧骨内推降低四级资质,39800.0,0
套餐皮秒激光玻尿酸精华导入清痘小魔盒,789.0,0
套餐皮秒激光PicoWay超皮秒全模式瑞蓝唯v1mL毛孔小魔盒,5989.0,0
套餐皮秒激光嗨体25mL术唯可2mL毛孔小魔盒,1389.0,0
点阵激光清痘小魔盒改善痘坑痘印,689.0,0
微针美肤悦白之几3ml胶原蛋白III型胶原嫩肤补水,2980.0,0
皮秒激光PicoWay超皮秒平扫模式背部嫩白正规采买支持验真,3980.0,0
光子嫩肤嫩肤模式黑金超光子身体亮白背部或大腿等5选1正版仪器,5800.0,0
隔空减脂腰部腹部2选1紧致肌肤正规采买仪器验真,1980.0,0
丽驻兰蓝盒1mL改善痘痘修复痘坑支持现场查验,8800.0,0
丽驻兰黑盒1mL收缩毛孔补水嫩白支持到院查验,6800.0,0
丽驻兰白盒1mL淡眼纹黑眼圈支持到院查验,8800.0,0
韩佳人3mL改善细纹修复敏感肌改善毛孔粗大,1980.0,0
韩国品牌200单位瘦腿瘦肩2选1进口支持扫码现场验真,2980.0,0
隔空减脂背部YG定点排脂非侵入式瘦背减脂改善臃肿华丽出圈,999.0,0
射频紧肤双下巴下颌缘钻石超塑限周一至周四使用紧致提升抗衰,3960.0,0
射频减脂腹部腰部2选1黄金微雕免费接车免费面诊瘦身美体,4999.0,0
激光减脂腰腹大腿2选15G天使减脂免费接车免费面诊,23800.0,0
套餐抗衰小魔盒,14199.0,0
套餐抗衰小魔盒,8999.0,1
套餐Fotona4DPro术唯可2mL嗨体25mL抗衰小魔盒,2999.0,0
半永久纹眉韩式氧气眉自然眉形个性化定制,5800.0,0
半永久美瞳线睁眼有神灵动眼眸含补色1次,1980.0,0
半永久纹眉丝雾眉含补色1次层次分明眉形立体,2980.0,0
半永久纹眉3D仿真眉个性化定制,6800.0,0
半永久纹唇改善唇色裸妆唇自然上镜,3800.0,0
半永久纹眉韩式野生眉妈生感野生眉私人订制,3800.0,0
眼部综合6项切开双眼皮内眦上睑提肌翘睫等免费接车四级资质,12799.0,0
眼部综合7项切开双眼皮内眦上睑提肌切眉等免费接车四级资质,16799.0,0
膨体隆鼻射极峰进口假体免费接车免费面诊,12800.0,0
鼻部综合5项肋软骨隆鼻射极峰膨体等免费接车四级资质,35820.0,0
鼻部综合3项美迪菲假体单侧耳软骨鼻小柱延长正规假体免费接车,9899.0,0
歪鼻矫正免费接车四级资质美学设计改善鼻型,9800.0,0
菲欧曼12mLFILLMED玻尿酸支持扫码当面验真艺术填充,12800.0,0
肤柔美05mL胶原蛋白支持扫码当面验真,4800.0,0
下颌角整形磨骨四级资质免费接车免费面诊,12799.0,0
面部轮廓综合1项VLINE瓜子脸手术四级资质免费接车,40800.0,0
种植发际线500单位不剃发种植免费接车免费预约长发种植,9888.0,0
美人尖种植1000单位美学设计艺术种植免费接车,6888.0,0
新一代热玛吉面颈部900发正版仪器支持验真单人单头,19800.0,0
假体隆胸傲诺拉璀璨水滴型四级资质免费接车,118000.0,0
假体隆胸傲诺拉星熠四级资质免费接车,68000.0,0
种眉毛FUE免费接车免费面诊改善眉毛残缺和稀疏,6888.0,0
乔雅登缇颜1mL玻尿酸支持扫码当面验真,12799.0,0
伊妍仕1mL支持验真少女系列胶原蛋白填充法令纹等4选1年轻抗衰,18800.0,0
肤丽美1mL胶原蛋白支持扫码当面验真美学设计,8800.0,0
爱贝芙05mL胶原蛋白进口支持扫码当面验真,17800.0,0
濡白天使075mL玻尿酸支持扫码当面验真美学设计,9900.0,0
宝尼达05mL玻尿酸正规采买支持验真美学设计,16800.0,0
海魅1mL玻尿酸支持扫码当面验真支撑塑型好,9800.0,0
手术缩鼻尖免费接车免费面诊美鼻侧颜,6800.0,0
外切祛眼袋免费接车免费面诊眼周年轻化改善倦容,4320.0,0
假体隆胸曼托毛面水滴型魅力版四级资质免费接车,26800.0,3
下颌角整形长曲线四级资质免费接车,23800.0,0
假体隆胸傲诺拉闪耀毛面圆型免费面诊免费接车,48000.0,0
假体隆胸免费接车傲诺拉绚耀毛面水滴型手感柔软四级资质,88000.0,0
假体隆胸曼托光面圆型免费接车免费面诊进口假体,19799.0,0
